Date,Titre,Texte,Subreddit,URL,Score,Langue
2025-10-24 17:15:04,CritTech 02  Indias Growth Spurt  tldr nirfed," Overview

ASPI in 2023 shook global strategic circles with a report on China dominating 57 out of 64 critical technologies contributing a whopping 39 of all quality research While the Anglosphere 22 and Europe 16 could challenge this dominance as blocs as an individual nation only the US 15 comes close to China India comes 3rd at 5

In my previous post I discussed how India ranks 3rd globally in both quantity and quality in recent years 4th in consistency and 5th historically 21 years in quality research Apart from a need to improve the quality to quantity ratio these results reveal Indias sudden emergence in the global science and technology stage In this post I try to understand Indias growth spurt discussing only the contributions in quality research ie top10 research by citation count We are not looking at consistency ie hindex tough to track over years or raw quantity

Post 00 About the Series

Post 01 Indias Standing

ASPIs Interactive TechTracker Website

Data This post is based on data from Australian Strategic Policy Institute ASPI who have since 2023 maintained a database about scientific research in certain critical strategic technologies They measure which country contributed how much to the top research in each technology 12 Their work is free to view at the website 3 A large portion of this post also uses data from the report RD Statistics at a Glance 202223 by the NSTMIS which is a Government of India Department of Science  Technology arm that tracks RD related statistics in India 14 The India data is compared to data from several G20 countries obtained from the OECD 43 and the United Nations 47 48

Disclaimer ASPI and NSTMIS are not responsible for this post or any analysis or opinions contained in it

Details For references methodology list of all technologies other posts in this series and other meta discussion like volunteering please refer to my Post 00 Remember to read ASPIs original reports at 1 and 2  and visit their website 3

 Historical Contributions by Region 2003  2023

Figure 2A Historical contributions to top1037 highly cited research in 64 critical technologies by region Percentage contribution to each technology first calculated and then averaged Data from  For more on methodology read the ASPI reports linked in my Post 00  i Top Yearly shares by region ii Bottom Cumulative shares by region starting from 2003 Regions top to bottom SubSaharan Africa thin green West Asia North Africa red South America yellow Oceania thin cyan Eurosphere Eurasia lighter blue South Asia dark gold India South East Asia yellow East Asia China Anglosphere 

Chinas dominance today is a story of 20 years of consistent linear growth at the expense of a similar linear decline in the Anglospheres contribution led by the US since about 2004 The Eurosphere  East Asia have similarly lost ground since 200910 and West Asia  South East Asia have picked up some of this slack around the same time But unmistakably China has been the biggest winner Again unmistakably the second biggest winner has been India starting much later around 2016

Despite the global Norths recent backsliding in its share of global research their historical contribution can still have longlasting effects Patents take 20 years to expire for instance Going from lab to industry is a long process in most technologies and their effects are plain to see in the continued industrial dominance of Western companies in several strategic sectors China having now secured a competitive spot even in terms of cumulative historical research contribution can be expected to have achieved similar competitiveness in many strategic industries As many strategic analysts point out it does

The global North has dropped the ball on research The Anglosphere  East Asia have surrendered a third of their research potential to effectively facilitate Chinas rise The Eurosphere also let go of a fifth of its cumulative research power so to speak India West Asia  South East Asia took on some of the responsibility since 2010

Indias share was a quarter of Chinas even in 2003 But while China rose consistently for a whole 20 years India only picked up its pace in the recent past The next figure makes this more clear One last note West Asia started off better than India but hasnt caught up to Indias recent rapid rise Neither has South East Asia largely led by Singapore been able to expand on its gains to be competitive with India Indias rise if consistent could mimic Chinas in its rapidity and potentially capture a large chunk of global share in research

 Yearly Contributions by Country 2003  2023

Figure 2B Yearly contributions to top1037 highly cited research in 64 critical technologies by country during the 2003  2023 period These 9 countries are the only ones who have been in the top 5 during this period Percentage contribution per technology is calculated then averaged across technologies Data from  i Top As described ii Bottom Same but in log scale

The two graphs above show the same data In the first figure the US  China dominate and all other countries contributions are barely noticeable The second figure is in logarithmic scale so we can visualise the other countries progress

China  the US have an absolute command over global science As the US continues to cede space to China research from Japan  France continue to decline rapidly The UK resisted the decline till around Brexit in 2020 The German growth story reversed in 2010 and Italys around 2014 but Italy maintained far more ground than other declining countries in this list South Korea is the only developed country here to maintain positive growth

Indias story is the most different from the bunch India has always made a somewhat bumpy upward progress in its share of global research Since 2019 the progress has been in a consistent upward trajectory Depending upon how you choose to smooth out the rough bumps you might even notice the trajectory beginning a few years earlier around 2010

 Yearly Gross Domestic Product 2003  2023

Figure 2C Yearly share in global gross domestic product GDP current prices by country during the 2003  2023 period in log scale for the countries in Figure 2B Data from the UN Statistics Division

One might think that a countrys research output is proportional to its share of global GDP The figure above gives the global share of GDP by country for the top 9 countries in highly cited research in the 64 critical technologies 

The relationship between GDP and a countrys critical technologies research output is rather unclear and varies with the country For some there is some correlation even if not strong An increase in Chinas share of global GDP coincides with an increased share of highly cited research a reduced share in GDP for Japans  Frances coincides with reduced research output For Germany Italy  the UK the decline in research starts about 10 years after their GDP share starts to decline

The US South Korea  India are unusual cases USAs share in global GDP stays static even as its critical technologies research output reduces South Koreas share of global GDP in 2023 is roughly the same as 2003 but it has made gains in research not as dramatic as China or India Indias rise in share of critical technology research oddly happens more consistently around the time when its growth in share of global GDP plateaus

So GDP alone does not explain research output Particularly Indias

 Yearly RD Investment by Country 2003  2023

Figure 2D Yearly gross expenditure in research and development GERD by country during 2003  2023 as a percentage share of i Global GDP that year log scale ii National GDP that year for the countries in Figure 2B Data from the UNESCO Institute for Statistics and UN Statistics Division

Different countries could be spending different amounts on research ie they have different Gross Expenditure in Research and Development or GERD This is tracked by countries as part of the sustainable development goals set by the UN SDG 95 In the figures above GERD is represented as a percentage of either the global GDP or national GDP for a given year I will be using the abbreviation GERDN as a shorthand for GERD as a percentage of national GDP GERDN is a decent indicator of how much an individual country prioritises research over other expenses Data is from United Nations agencies 47 48

These graphs with Figure 2B and 2C describe a complicated story and I will take you through it bit by bit starting with the declining powers

The United States has plateaued in its share of global GDP This coincides with a dramatic loss in its share of global highly cited research each year ceding space to China A recent increase in RD funding has halted the rapid decline But it remains a mystery how despite having nearconstant GERDN from 2003 to 2020 the USA steadily lost ground to China

This is similar to Germanys mysterious decline in share of critical technology research despite using steadily increased GERDN to make up for its steadily declining global GDP share France is equally odd Unlike Germany Frances increase in GERDN has not kept up with the decline in global GDP share Even so the absolute descent in its share of global research is far too dramatic to be explained simply by a reduced share in global GERD 

In these 3 cases the USGermany  France additional government or industry policies must have led to their diminished share of research Their research decline looks worse than their funding would suggest I wont try to figure out why that is the case because citizens of these countries are better equipped to do that My gut says that this has something to do with outsourcing research to China but I have no solid citations on the matter

The UK similar to the US halted its decline in research outcomes with major increases in RD funding despite a downward tumbling GDP share that would have otherwise dragged down its share in global research even further The recent rapid drop coincided with Brexit but I will leave British scholars to figure out the link

Japan has had the most precipitous decline in global GDP share Despite irregular increases in its GERDN the decline in GDP has dragged down its share in research Italy is similar  their steadily increasing GERDN could not make up for the far more rapid decline in GDP 

China more than doubled its GERDN over 21 years and along with a dramatic increase in GDP it makes sense how it has come to dominate global research South Korea also doubled their GERDN but with stagnant GDP share their share in global research has only seen moderate but steady progress

In all four cases Japan Italy China  South Korea research funding alone can quite easily explain the observed research outcomes No mystery here

Indias growth spurt is exceptional With relatively poor GERDN and twiceplateaued GDP how India managed to accelerate its research progress is unclear As with the US Germany  France if funding cant explain the oddity it must be some government  industry policies

 Government of India Programs and Policies

Very few policies or initiatives in GoIs Department of Science  Technology DST website seem to begin around when Indias scientific output accelerated ie first in 2010 and then 2019 A list of all programs is in Post 00 There are two I would like to highlight in particular because they coincide with Indias accelerated rise

The PURSE Program

The PURSE Promotion of University Research and Scientific Excellence program started in 2009 33 with the objective of promoting toptier research in universities But why was this program even needed Isnt that the whole point of GoIs RD budget Well no

Typically scientific research at universities is funded through government grants private or industry grants arent as common no citations These government grants are funnelled through certain scientific agencies under the government These scientific agencies make up less than 40 of the governments GERD and not all of it goes out as grants So how much funding do universities actually get It is difficult to tell A rough estimate adding up the RD funding going to ICAR DST CSIR and DBT stands at about 13 of Indias total GERD Where does the rest of the money go You will have to wait for the next post for that

Having more avenues for funding research makes sense in this context and PURSE was designed specifically to promote high quality research in domains of national priority PURSE explicitly excludes academic institutes such as IISc IITs IISERs NITs etc since they already had an active research culture and so had easier access to funds from the scientific agencies like DST DBT etc As a rule of thumb universities with a University in their name were eligible for PURSE funding PURSE helped many universities improve their research outcomes  quality publications during and even after their PURSE funding concluded 33

But PURSE is a small initiative If my math is right the total peryear expenditure in PURSE Phase IA  IB was 03 of Indias 201011 GERD Its impact is difficult to judge since the ASPI data does not have enough details on the historical research trajectory of all individual Indian institutes in their data However one thing could be noted since 2010  Indias research trajectory began to steadily take on exponential growth Figure 2B Whether it was PURSE or some general trend of prioritising research there was some visible impact

On a separate note this may be partly why the Anusandhan National Research Foundation NRF was announced with the National Education Policy NEP in 2020 40  to give more avenues for grants NRF was constituted only in February 2024 with a first year budget of 2000 crores For context Indias total GERD in 202021 was about 127000 crores which means that NRF got at most 16 of Indias GERD If I am not wrong the 202526 budget documents reveal that only 200 crores out of the budgeted 2000 crores were spent 39 You can put that down under teething troubles but this is not an auspicious start A budget of 1950 crores has been allocated for 202526 Hope we spend it this time

NIRF When short on carrots

The biggest growth spurt in Indias research started in 2019 And the hero here or the culprit is the National Institutional Ranking Framework or NIRF NIRF was announced in 2015 with the purpose of ranking universities institutes and colleges all over India 36 As a ranking provided by the government this has an enormous impact on which colleges are considered the best for prospective students in Indias higher education system

Why does NIRF matter Because for the first time ever universities  colleges in India were going to be scored on their research outcomes 36 as part of a government ranking for institutes NIRF had announced that for the Overall rankings it would give 40 weightage to research outcomes Out of the 40 4 was reserved for patents The remaining 36 was split evenly between i a percentile score for number of publications per faculty and ii the total number of citations per publication which for some reason was again multiplied with percentile in subscore i So now 36 of what determines your colleges ranking reputation enrollment and probably most importantly tuition fees you can claim from the richer but less meritorious applicants is now governed by research outcomes Yuck

Believe it or not the weightage for research is no longer 40 now It was set to 30 in 2019 37 Which honestly I am surprised hasnt been dragged lower by incessant lobbying Honestly considering the backlash NIRF gets I applaud GoI for standing its ground at 30

Very few institutes research trajectories have been presented in the ASPI data 3 Among the 21 trajectories that were not an IIT IISc NIT or a GoI scientific institute 19 showed a noticeable increase in research output after 2016 The only exception was Anna University which for some unknown reason actually cared for research before NIRF Details in Post 00

So I can confidently say that most institutes in India especially private institutions of higher education only took interest in research after NIRF rankings started to affect their reputation and thus bottomlines I am not the first to notice the huge impact that NIRF has had on Indias publication and citation numbers A careful analysis by some scholars shows how state universities have been slipping while NITs  deemed universities have risen in their research outcomes 38 The good news here is that neither have shaken the IITs from their top position despite the competition having considerably heated up in recent years

Taking Goodhart to heart

In my previous post Post 01 I had figures showing how India has ranked highly in ASPIs rankings for publications in terms of raw numbers and citation counts Note that these are the metrics NIRF is also measuring The main difference being that ASPI measures for each technology separately which makes more sense since some domains naturally have high publication rates and others have low But India lagged behind on hindex according to ASPI a metric that NIRF is not measuring Naturally there have been calls for adding an hindex metric to the NIRF rankings under the belief that what is measured will be improved But will it help 

There is also the problem that the NIRF ranking equates one citation on a food habits survey paper with one citation in a thorium salt reactor design improvements Expertise in niche technological domains is not rewarded by NIRF Research domains where it is easier to publish eg if they do not require high capital expenditure on scientific instruments will be unduly rewarded while harder slower research is ignored because of low citation count Better qualified scientists have suggested more improvements to NIRF but will it help

As there has been a surge of publications in recent years and a soaring citation count there have been widespread reports on scientific malpractice in India Proliferation of casual papers with no serious science to increase publication numbers and colleges forcing their faculty to cite each others papers to increase citation counts A paper on fruit and vegetable consumption published by students and faculty from one university for instance had cited a study on diesel engines by others in the same university Paper mills and unethical low quality payandpublish journals abound 41 

These complaints dont even touch the social problems created by gamifying research like the exploitation of students a nationwide loss of integrity and the consequent issues this may cause for the reputation of meritorious researchers from our country

The government noticed how widespread the problem is and decided to modify NIRF to now give negative marks for universities with paper retractions and other research malpractice Over the past two to three years many institutes have seen a significant number of research papers retracted raising concerns about their credibility Experts say that unless negative marks are introduced institutes are unlikely to take corrective action 42 Whether this will improve academic integrity or instate a not on paper corruption it is hard to say

This chain of events is something you might expect when the gamification of quantitative metrics requires colleges to produce more research output without a concomitant increase in GERDN As good old Goodheart once said whenever a government seeks to rely on a previously observed statistical regularity for control purposes that regularity will collapse What you measure you corrupt

On the positive side even if the metrics have been gamified and perverted this has created a culture of research in India that did not previously exist at this scale You can see how the IITs have pushed themselves harder because of this competition 38 although it may also be that they have joined in on the corruption While it is hard to envisage a metric that cannot be corrupted by Goodhearts law truly valuable research can change the landscape of Indias public and private sector industry 

 Opinion

A general malaise has taken over Indias university system with little investment to upgrade even the normal civic infrastructure let alone the unimaginable capital expenses you need to purchase state of the art scientific equipment An academician faces a whole lot of byzantine bureaucracy even when funding is secure This environment creates sequestered scientists whose work becomes more removed from industrial applications These are some of the issues JNU Professor Binay Panda mentions in his critique of the ANRF 49 Please give it a read Some of his other points probably no longer apply after the recent RDI scheme announcement so keep that in mind

The atrophied research skills in Indian institutions is now being highlighted by the postNIRF scandals of academic malpractice 41 42 The fact that universities in themselves should be a place to conduct research not just get degrees has disappeared from our consciousness The longer this marital separation of higher education from research prolongs the more perilous our path to progress

 Conclusion

For countries like China Japan South Korea and Italy RD expenditure trends track with the countrys research output in critical technologies For some like the US UK France and Germany their share of global critical technology research actually is less than what their funding should suggest And for India the biggest oddball of the bunch we see a growth spurt despite a practically stagnant share in global RD expenditure All thanks to NIRF

While NIRF has definitely shaken up Indias higher education sector forcing it to relearn the lost art of research it is not clear if there is any more juice you can squeeze out of this lemon before things get too bitter There is only so far you can push scientists to publish papers without any uptick in the shameful 065 of our GDP that we spend on GERD Academic malpractice has already become far too common

Nonetheless even though it is not sustainable in the long run this approach of naming and shaming universities for their research performance has allowed India to consistently up its game both in the raw number of papers as well as the quality of these papers Now that the higher education sector has been spurred into action it is time for there to be an enormous increase in the RD expenditure 1 of GDP is a bare minimum 

And if we dont its brain drain or brain rot or both",GeopoliticsIndia,https://www.reddit.com/r/GeopoliticsIndia/comments/1of3kus/crittech_02_indias_growth_spurt_tldr_nirfed/,3,en
2025-10-24 17:13:47,Anyone know about Ben 10 being in a Romantic Comic,nan,Ben10,https://i.redd.it/azyfl9cke3xf1.jpeg,1,en
2025-10-24 17:13:16,Pluto in 1st houses,"Ive just started exploring astrology and I noticed when looking at my and my toddler sons chart that we both have Pluto in our 1st house Is this pretty unusual 
My chart is on the first slideleo sun libra AC 
So far in my own life I had a major transformation after the death of my daughter my first child at birth Almost everything in my life fell apart and I feel like a completely different person since 
Could the fact that we both share this placement mean that we are probably impacted by this same trauma life change
Could the death of his big sister have potential to majorly impact my sons life even though he wasnt born yet when all of that happened Or am I just projecting and his pluto is probably signifying something else completely 
Also slightly concerned with his Uranus in the 4th house and hoping our trauma we his parents experienced doesnt negatively affect his life I am brand new to astrology and might be way off base so any insights or information is very appreciated ",astrologyreadings,https://www.reddit.com/gallery/1of3j6p,1,en
2025-10-24 17:11:41,All loaded up for the guild yard at All Hallows in Angles camp CA Anyone going,nan,renfaire,https://www.reddit.com/gallery/1of3hqa,5,en
2025-10-24 17:09:43,How do you approach learning new concepts in BJJ  and is the sport evolving in the right direction,"The WNO 30 brackets just dropped and WNO is experimenting with a Call Your Shot submission bonus tonight 

Its an interesting move  feels like Flo is trying to make matches more aggressive after how CJI 2 started out

A lot of people called that first day boring but honestly when youre rolling with grapplers at that level the smallest of openings can be exploited Its hard to open up when one mistake could cost you the match

That kind of reminds me of training Theres always that balance between experimenting and refining what already works

So Im curious how do you guys actually learn new concepts or positions in your own training

 Do you figure things out through rolling or do you need to drill and break it down first
 Do you focus more on the why behind a move or just repping it until it sticks
 And what about instructionals  do you use them on a regular basis

Would love to hear how people at different levels approach this  hobbyists competitors coaches Whats actually helped you get better and what do you make of where things are going",brazilianjiujitsu,https://i.redd.it/zr6r9cdud3xf1.jpeg,1,en
2025-10-24 17:07:57,Male suspects breaking into mothers house at Hackley Ave Des Moines IA,Male suspects breaking into mothers house at Hackley Ave,centraliowascanners,https://www.crimeradar.us/m/5725_1761323192_kekkbvvo?pd%3D0NzrhuGB%26lang%3Den_US%26s%3Di0%26_f%3Dapp_share%26send_time%3D1761325645%26gen_by%3Dios,1,en
2025-10-24 17:06:52,First panel howd I do,For info this is going to be put into a system and I believe it is a sub panel Since its going into an apartment or some odd ,electricians,https://i.redd.it/l9srzb6cd3xf1.jpeg,4,en
