Date,Titre,Texte,Subreddit,URL,Score,Langue
2025-10-24 17:34:17,Which grammar is better to send to the Spanish embassy,"Hi all

Could someone please assist me with which one of these 2 translations is more grammatically accurate",SpanishLearning,https://www.reddit.com/gallery/1of4341,1,en
2025-10-24 17:32:33,Worth the pain,So it was a bit painful but I have my A1 up and running and it makes beautiful prints My initial calibration problem was solved by removing the screw underneath holding the cable tray When it was screwed in it pulled the usb connector back a couple mm and made a bad contact After that the nozzle was super clogged surprising in a new machine It took 45 pokes with the needle tool and 3 cold pulls but then it was finely cleaned Ran a benchy and its beautiful Am a happy camper ,BambuLabA1,https://i.redd.it/j9bviwxwh3xf1.jpeg,1,en
2025-10-24 17:31:47,Can i get a rbh dilo with this 2nd pic is with two toys only,nan,growagardentradehub,https://www.reddit.com/gallery/1of40pu,1,en
2025-10-24 17:31:30,AI use in American newspapers,nan,MapPorn,https://i.redd.it/ycots1eph3xf1.jpeg,2,en
2025-10-24 17:31:18,Rivals gods blessed me w 7 wins in a row and to diamond 3 but then got hit back straight to reality,nan,rivals,https://i.redd.it/oexi650ph3xf1.jpeg,1,en
2025-10-24 17:31:00,Keep farming for more HP or no,"

Do I try to farm those three more flat HP rolls or do I leave it at that Just got that disk 3 today so I want to know some opinions",LuciaMains,https://www.reddit.com/r/LuciaMains/comments/1of3zzu/keep_farming_for_more_hp_or_no/,1,en
2025-10-24 17:29:17,HAS ANYONE DONE THIS,Looking to upgrade off my plastic cap as its starting to wear Id hate for it to get stuck on there Anybody make the jump to metal ,ToyotaTundra,https://i.redd.it/4s897f2ch3xf1.jpeg,3,en
2025-10-24 17:27:56,Love me some high nutrient foods,nan,ShittyVeganFoodPorn,https://i.redd.it/0p7e56b3h3xf1.jpeg,8,en
2025-10-24 17:27:27,Thoughts on 1964s The Best Man And Gore Vidals scathing depiction of the likes of Kennedys Nixon McCarthy and Kefauver,nan,Presidents,https://i.redd.it/njyqukd0h3xf1.jpeg,0,en
2025-10-24 17:27:20,Guys,I was just looking around and I saw that I immediately paused the game ,jurassicworldevo,https://i.redd.it/gug0xnhzg3xf1.jpeg,4,en
2025-10-24 17:25:45,Analysis We havent seen any other Haki Clash like Garp vs Kuzan because its not a HakiClash Both Characters punched eachother in the face instead of clashing Garp can cause massive HakiExplosions so its likely this Explosion was caused by Garps Haki as well,Both Garp and Kuzan get catapulted back from this which does not refute my argument Garp might have send himself flying with his own shockwave too or it was just from Kuzans punch to his face,OnePiecePowerScaling,https://i.redd.it/u2brpkqxe3xf1.png,1,en
2025-10-24 17:25:01,Fantastic Four HISHE just dropped How It Should Have Ended on YouTube  link in caption,"

",FantasticFour,https://www.reddit.com/r/FantasticFour/comments/1of3u3u/fantastic_four_hishe_just_dropped_how_it_should/,1,en
2025-10-24 17:24:36,Help me out here,is it wise to give this evo to joshplaying CB or garcia or should i go with the popular choice  Ill appreciate any comment on this,fut,https://www.reddit.com/gallery/1of3tp1,1,en
2025-10-24 17:22:26,Good Price or should I wait for BF ,"Hello 

Just add this offer do you think its worth or should I wait BF  

",LenovoLegion,https://i.redd.it/hvl3z954g3xf1.jpeg,1,en
2025-10-24 17:21:45,Anyone got this one tradeable for less than 20k,If you have this one tradeable or the Eisbren Logo please hit me up,NHLHUT,https://i.redd.it/6g3w2oizf3xf1.jpeg,2,en
2025-10-24 17:21:37,If the Eiffel Tower were in India,nan,shitposting,https://i.redd.it/wt2agpnyf3xf1.png,0,en
2025-10-24 17:21:11,JSAF meme,mY fIrSt MeMe DoNt BuLlY,JackSucksAtLife,https://i.redd.it/4brme8hpf3xf1.png,0,en
2025-10-24 17:20:48,US Selling Cowboy Bebop The Complete Series Bluray Crunchy Roll 20,"PayPal FF preferred USPS media mail will be used Ill give you free shipping

Thanks",MediaSwap,https://www.reddit.com/gallery/1of3q4z,1,en
2025-10-24 17:20:34,Just watched a 2 hour 20 mins podcast by Jon Hernndez with ukasz Kaiser Lead Researcher from OpenAI  thoughtful perspectives on AIs direction  more details below,"This long interview offers an interesting look at how AI research may evolve in the years ahead ukasz Kaiser coauthor of Attention Is All You Need discusses topics such as

what intelligence really means  
why hes cautious about the term AGI  
reasoningbased models and their impact  
hardware and energy bottlenecks  
AIs role in accelerating science  
and OpenAIs approach to future devices

Its a calm reflective talk that combines technical insight with perspective on how the field might mature Could be interesting for anyone following the longterm arc of AI development",LovingAI,https://www.youtube.com/watch?v=gdPMNZo4Vb8,1,en
2025-10-24 17:18:58,NGD Fly balls will need to think twice,"My first top tier glove I used to have a 125 from a local brand last three pictures until I joined a semipro league and everyone wearing HOH A2K and A2000 so saved some money and leveraged from Bonanza day and here we are

Cheers from Monterrey MX ",BaseballGloves,https://www.reddit.com/gallery/1of3ogw,4,en
2025-10-24 17:18:13,Male suspect breaking into mothers house at Hackley Ave Des Moines IA,A male suspect was reported by a neighbor attempting to break into his mothers house near Hackley Ave He tried to enter through a window on the east side and may have left the area riding a bicycle The suspect may have an outstanding warrant,desmoines,https://www.crimeradar.us/m/5725_1761323192_kekkbvvo?pd%3D0NzrhuGB%26lang%3Den_US%26s%3Di0%26_f%3Dapp_share%26send_time%3D1761326231%26gen_by%3Dios,0,en
2025-10-24 17:16:38,Prague Leica M6  Summicron 35mm  Kodak Portra 400,A few shots from my short trip to Prague Im quite surprised by how they turned out I hope you like them ,analog,https://www.reddit.com/gallery/1of3mbs,3,en
2025-10-24 17:15:33,My Leeknow scrapbook page,Happy Birthday to our cat butler and butt hunter ,skzmedia,https://i.redd.it/sfk7ev0ve3xf1.jpeg,4,en
